X,Y,Name,description,timestamp,begin,end,altitudeMode,tessellate,extrude,visibility,drawOrder,icon
70.887196,22.787159,Millenium Papers Pvt Ltd,,,,,,-1,0,-1,,
70.9829973,22.7082905,Camerich Papers Pvt Ltd,,,,,,-1,0,-1,,
77.5569265,8.7066957,Sun Paper Mills,,,,,,-1,0,-1,,
79.1119573,21.1496164,Malu Paper Mills Ltd.,,,,,,-1,0,-1,,
78.8763133,21.4044286,Malu Paper Mills Savner,,,,,,-1,0,-1,,
76.7639499,30.7195549,Hindustan Paper Corpn Ltd,,,,,,-1,0,-1,,
75.806758,26.918721,Hindustan Paper Corporation Limited,,,,,,-1,0,-1,,
88.3544933,22.5509537,HINDUSTAN PAPER CORPORATION LIMITED,,,,,,-1,0,-1,,
92.2130585,26.120687,Hindustan Paper Corporation Limited,,,,,,-1,0,-1,,
77.5809105,12.9940996,Hindustan Paper Corpn Limited,,,,,,-1,0,-1,,
78.4896,17.441384,Hindustan Paper Corporation Limited,,,,,,-1,0,-1,,
92.5927091,24.8527961,Cachar Paper Mill,,,,,,-1,0,-1,,
77.3873488,10.5594329,GMJ Paper & Boards Private Limited,,,,,,-1,0,-1,,
77.7607369,11.3509545,Seshasayee Paper And Boards Ltd,,,,,,-1,0,-1,,
77.1570495,11.4965196,Aaditiya Aswin Paper Mills Pvt Ltd,,,,,,-1,0,-1,,
77.9768986,11.4511361,MSP Paper Mill Private Limited,,,,,,-1,0,-1,,
77.9693699,11.1323185,Kovai Maruthi Papers and Boards (P) Ltd. KMP,,,,,,-1,0,-1,,
77.9938498,11.0595306,Tamilnadu Newsprint and Papers Limited,,,,,,-1,0,-1,,
77.477811,10.479097,Sri Gajendira Paper and Boards Private Limited,,,,,,-1,0,-1,,
77.3513353,10.4595007,"SIVADHARSHINI PAPERS PVT. LTD.,",,,,,,-1,0,-1,,
77.3873488,10.5594329,GMJ Paper & Boards Private Limited,,,,,,-1,0,-1,,
76.94392,11.04477,Sri Venkatesa Group,,,,,,-1,0,-1,,
80.2433217,13.0056171,Sri Venkatesa Paper & Boards,,,,,,-1,0,-1,,
77.570773,12.964114,Amaravathi Sri Venkatesa Paper Mills Limited,,,,,,-1,0,-1,,
77.7288294,28.9930515,Shree Venkatesh Paper Mills,,,,,,-1,0,-1,,
76.0766472,31.3058235,Abc Paper Limited,,,,,,-1,0,-1,,
81.41773,16.836724,Venkata Naga Lakshmi Paper Mills Pvt Ltd,,,,,,-1,0,-1,,
81.7718663,17.0275341,International Paper APPM Ltd,,,,,,-1,0,-1,,
72.8241272,18.9236295,Andhra Pradesh Paper Mills Limited,,,,,,-1,0,-1,,
76.7888318,30.6907205,A P Paper Mills Limited,,,,,,-1,0,-1,,
77.017838,28.46385,Ballarpur Industries Ltd,,,,,,-1,0,-1,,
79.52,29.08,Century Pulp And Paper,,,,,,-1,0,-1,,
78.4078145,17.4221397,Delta Paper Mills Ltd,,,,,,-1,0,-1,,
75.8572758,30.900965,Hemkunt Paper Mills,,,,,,-1,0,-1,,
73.9639675,18.1726234,Indo Afrique Paper Mill Pvt Ltd,,,,,,-1,0,-1,,
78.49011,17.4429345,ITC Paperboards and Specialty Papers Division,,,,,,-1,0,-1,,
80.8622718,17.6985493,ITC PSPD,,,,,,-1,0,-1,,
83.4133017,19.2497586,JK Paper Ltd.,,,,,,-1,0,-1,,
73.5645055,21.166359,JK Paper Ltd.,,,,,,-1,0,-1,,
80.2607068,13.0853311,J K Paper Limited,,,,,,-1,0,-1,,
72.8367776,18.9346619,Jk Paper Limited,,,,,,-1,0,-1,,
88.3469415,22.5694726,J K Paper Ltd,,,,,,-1,0,-1,,
77.2441075,28.6309308,JK Paper Limited,,,,,,-1,0,-1,,
74.884252,31.671331,Khanna Paper Mills Limited,,,,,,-1,0,-1,,
75.5810039,31.336029,Khanna Paper Mills Ltd.,,,,,,-1,0,-1,,
77.228931,28.649921,Khanna Paper Mills Ltd,,,,,,-1,0,-1,,
77.013531,28.43032,Khanna Paper Mills Limited,,,,,,-1,0,-1,,
77.2771756,28.6288177,K R Pulp & Papers Limited,,,,,,-1,0,-1,,
73.100365,19.25899,Laxmi Board & Paper Mill Ltd,,,,,,-1,0,-1,,
79.1358027,21.1488571,Murli Agro Products Ltd,,,,,,-1,0,-1,,
76.6788091,12.1665405,The South India Paper Mills,,,,,,-1,0,-1,,
73.884869,18.540715,MWV,,,,,,-1,0,-1,,
76.4002913,21.449161,Nepamills Limited,,,,,,-1,0,-1,,
81.5911722,23.1945398,Orient Paper Mills,,,,,,-1,0,-1,,
83.9603694,21.4813468,Orient Paper Mills,,,,,,-1,0,-1,,
76.9079447,9.0364943,Punalur Paper Mills,,,,,,-1,0,-1,,
78.4426308,17.439511,Sai Rayalaseema Paper Mills Limited,,,,,,-1,0,-1,,
77.883916,29.094022,Sangal Papers,,,,,,-1,0,-1,,
74.5192293,30.4207334,Satia Paper Mill,,,,,,-1,0,-1,,
72.90634,20.371237,Shah Pulp And Paper Mills Ltd,,,,,,-1,0,-1,,
76.2264929,27.8206737,"Shree krishna paper mills , paper plant",,,,,,-1,0,-1,,
76.9186252,28.7013304,Shree Krishna Paper Mills & Ind Ltd,,,,,,-1,0,-1,,
75.7432,26.96182,Sirpur Paper Mills Limited,,,,,,-1,0,-1,,
79.4886679,19.3513359,Sirpur Kagaznagar Paper Mill,,,,,,-1,0,-1,,
80.2309934,13.0665262,Sirpur Paper Mills Limited,,,,,,-1,0,-1,,
77.9690467,11.3758866,Sri Nandha Paper,,,,,,-1,0,-1,,
72.569032,23.0366892,Srinivas Papers,,,,,,-1,0,-1,,
78.4213617,10.689372,TAMIL NADU NEWSPRINT AND PAPERS LTD UNIT 2,,,,,,-1,0,-1,,
77.62,17.68,Trident Sugars Ltd,,,,,,-1,0,-1,,
74.6268676,15.2512181,West Coast Paper Mills Ltd.,,,,,,-1,0,-1,,
78.4595644,17.4191709,White Field Paper Mills,,,,,,-1,0,-1,,
82.2257298,26.7367649,Yash Papers,,,,,,-1,0,-1,,
76.4688024,9.8332402,Hindustan Newsprint Limited,,,,,,-1,0,-1,,
